{
  "version": 1,
  "generated_at": "2026-10-23T12:00:00Z",
  "project": {
    "id": "github.com/acme/widgets",
    "name": "widgets",
    "host": "gh",
    "checkout": "{root}",
    "remote": false
  },
  "window": {
    "since": "2026-10-16T12:00:00Z"
  },
  "sources": [
    {
      "name": "host",
      "ok": true,
      "took_ms": 0
    },
    {
      "name": "tracker",
      "ok": true,
      "took_ms": 0
    },
    {
      "name": "local",
      "ok": true,
      "took_ms": 0
    }
  ],
  "rows": [
    {
      "key": "FT-4",
      "stage": "merged-unfinished",
      "stage_from": "local",
      "who": {
        "agent": "ft-4-9ff56a",
        "author": "ann",
        "person": "ann"
      },
      "where": {
        "pr": {
          "number": 4,
          "title": "FT-4: login page",
          "url": "https://github.com/acme/widgets/pull/4",
          "state": "merged",
          "head": "FT-4/login",
          "base": "main"
        },
        "branch": "FT-4/login",
        "worktree": "{root}.FT-4-login"
      },
      "review": {
        "step": "finish"
      },
      "last_activity": "2026-10-20T10:00:00Z",
      "next": {
        "command": "f10 finish FT-4"
      }
    }
  ]
}
