{
  "version": 1,
  "generated_at": "2026-10-23T12:00:00Z",
  "project": {
    "id": "github.com/acme/widgets",
    "name": "widgets",
    "host": "gh",
    "checkout": "/code/widgets",
    "remote": false
  },
  "window": {
    "since": "2026-10-16T12:00:00Z"
  },
  "sources": [
    {
      "name": "host",
      "ok": true,
      "took_ms": 0
    },
    {
      "name": "tracker",
      "ok": true,
      "took_ms": 0
    },
    {
      "name": "local",
      "ok": true,
      "took_ms": 0
    }
  ],
  "rows": [
    {
      "key": "FT-1",
      "task": {
        "id": "FT-1",
        "title": "thing",
        "url": "https://github.com/acme/widgets/issues/1",
        "status": "open"
      },
      "stage": "implementing",
      "stage_from": "local",
      "who": {
        "agent": "ft-1-916fca",
        "agent_status": "working",
        "model": "sonnet"
      },
      "where": {
        "branch": "FT-1/slug",
        "worktree": "/code/widgets.FT-1-slug",
        "workspace": "FT-1"
      },
      "last_activity": "2026-10-20T10:00:00Z",
      "next": {
        "text": "at implement"
      }
    }
  ]
}
