{
  "version": 1,
  "generated_at": "2026-10-23T12:00:00Z",
  "project": {
    "id": "github.com/acme/widgets",
    "name": "widgets",
    "host": "gh",
    "checkout": "/code/widgets",
    "remote": false
  },
  "window": {
    "since": "2026-10-16T12:00:00Z"
  },
  "sources": [
    {
      "name": "host",
      "ok": true,
      "took_ms": 0
    },
    {
      "name": "tracker",
      "ok": true,
      "took_ms": 0
    },
    {
      "name": "local",
      "ok": true,
      "took_ms": 0
    }
  ],
  "rows": [
    {
      "key": "FT-2",
      "task": {
        "id": "FT-2",
        "title": "thing",
        "url": "https://github.com/acme/widgets/issues/2",
        "status": "open"
      },
      "stage": "blocked",
      "stage_from": "local",
      "who": {
        "agent": "ft-2-bc3293"
      },
      "where": {
        "branch": "FT-2/slug",
        "worktree": "/code/widgets.FT-2-slug"
      },
      "blocked_by": [
        "FT-1"
      ],
      "next": {
        "text": "waiting on FT-1"
      }
    },
    {
      "key": "FT-1",
      "task": {
        "id": "FT-1",
        "title": "thing",
        "url": "https://github.com/acme/widgets/issues/1",
        "status": "open"
      },
      "stage": "pr-open",
      "stage_from": "guessed",
      "who": {
        "agent": "ft-1-916fca",
        "author": "ann",
        "person": "ann"
      },
      "where": {
        "pr": {
          "number": 10,
          "title": "FT-1: thing",
          "url": "https://github.com/acme/widgets/pull/10",
          "state": "open",
          "head": "FT-1/slug",
          "base": "main"
        },
        "branch": "FT-1/slug",
        "worktree": "/code/widgets.FT-1-slug"
      },
      "last_activity": "2026-10-20T10:00:00Z",
      "next": {
        "command": "/f10:review FT-1"
      }
    }
  ]
}
