{
  "version": 1,
  "generated_at": "2026-10-23T12:00:00Z",
  "project": {
    "id": "github.com/acme/widgets",
    "name": "widgets",
    "host": "gh",
    "remote": true
  },
  "window": {
    "since": "2026-10-16T12:00:00Z"
  },
  "sources": [
    {
      "name": "host",
      "ok": true,
      "took_ms": 0
    },
    {
      "name": "tracker",
      "ok": true,
      "took_ms": 0
    },
    {
      "name": "local",
      "ok": true,
      "skipped": true,
      "took_ms": 0
    }
  ],
  "rows": [
    {
      "key": "FT-8",
      "task": {
        "id": "FT-8",
        "title": "quotas",
        "url": "https://github.com/acme/widgets/issues/8",
        "status": "OPEN",
        "after": "FT-7"
      },
      "stage": "blocked",
      "stage_from": "trace",
      "who": {
        "author": "ann",
        "person": "ann"
      },
      "where": {
        "pr": {
          "number": 8,
          "title": "FT-8: quotas",
          "url": "https://github.com/acme/widgets/pull/8",
          "state": "open",
          "head": "FT-8/quota",
          "base": "main",
          "mergeable": "clean"
        },
        "branch": "FT-8/quota"
      },
      "review": {
        "step": "judge",
        "round": 1
      },
      "blocked_by": [
        "FT-7"
      ],
      "last_activity": "2026-10-20T10:00:00Z",
      "next": {
        "text": "waiting on FT-7"
      }
    },
    {
      "key": "FT-9",
      "task": {
        "id": "FT-9",
        "title": "export",
        "url": "https://github.com/acme/widgets/issues/9",
        "status": "OPEN"
      },
      "stage": "ready",
      "stage_from": "trace",
      "who": {
        "author": "ann",
        "person": "ann"
      },
      "where": {
        "pr": {
          "number": 9,
          "title": "FT-9: export",
          "url": "https://github.com/acme/widgets/pull/9",
          "state": "open",
          "head": "FT-9/export",
          "base": "main",
          "mergeable": "clean"
        },
        "branch": "FT-9/export"
      },
      "review": {
        "step": "judge",
        "round": 1
      },
      "last_activity": "2026-10-20T10:00:00Z",
      "next": {
        "command": "f10 finish FT-9"
      }
    },
    {
      "key": "FT-7",
      "task": {
        "id": "FT-7",
        "title": "rate limit",
        "url": "https://github.com/acme/widgets/issues/7",
        "status": "OPEN"
      },
      "stage": "in-review",
      "stage_from": "trace",
      "who": {
        "author": "ann",
        "person": "ann"
      },
      "where": {
        "pr": {
          "number": 7,
          "title": "FT-7: rate limit",
          "url": "https://github.com/acme/widgets/pull/7",
          "state": "open",
          "head": "FT-7/rate",
          "base": "main"
        },
        "branch": "FT-7/rate"
      },
      "review": {
        "step": "resolve",
        "round": 1,
        "open": 2
      },
      "last_activity": "2026-10-20T10:00:00Z",
      "next": {
        "command": "/f10:resolve FT-7"
      }
    }
  ]
}
