{
  "version": 1,
  "generated_at": "2026-10-23T12:00:00Z",
  "project": {
    "id": "github.com/acme/widgets",
    "name": "widgets",
    "host": "gh",
    "checkout": "{root}",
    "remote": false
  },
  "window": {
    "since": "2026-10-16T12:00:00Z"
  },
  "sources": [
    {
      "name": "host",
      "ok": false,
      "error": "gh: gh: To get started with GitHub CLI, please run:  gh auth login\nAlternatively, populate the GH_TOKEN environment variable with a GitHub API authentication token.",
      "took_ms": 0
    },
    {
      "name": "tracker",
      "ok": false,
      "error": "gh: gh: To get started with GitHub CLI, please run:  gh auth login",
      "took_ms": 0
    },
    {
      "name": "local",
      "ok": true,
      "took_ms": 0
    }
  ],
  "rows": [
    {
      "key": "FT-2",
      "stage": "implementing",
      "stage_from": "local",
      "who": {
        "agent": "ft-2-323608",
        "committers": [
          "ann@acme.example"
        ],
        "person": "ann@acme.example"
      },
      "where": {
        "branch": "FT-2/widgets",
        "worktree": "{root}.FT-2-widgets"
      },
      "last_activity": "2026-10-23T12:00:00Z",
      "next": {
        "text": "at cleanup"
      }
    }
  ]
}
